v2.4.6/jsonschema-specifications/jsonschema-specifications_galaxy_gpu.json

{"meta":{"zero_dependency_mode":false,"missing_dependencies":{"networkx":false,"tiktoken":false,"xgboost":false,"pyyaml":false},"schemas":{"galaxy_columns":["names","paths","lang_ids","locs","m_locs","d_locs","mass","author_distribution","ownership_entropy","raw_churn_freq","cog_raw","pos_x","pos_y","pos_z","risks_flat","hits_flat","tel_aid","tel_pid","tel_purp","tel_lt","tel_pop","tel_cfr","ai_threats","satellite_data_flat","satellite_offsets","imports","c_ids","a_ids","a_dists","edges","outbound_edges"],"singularity_columns":["paths","exts","reasons","sizes","confidences"],"risk_vector_x1000":["cognitive_load","safety_score","tech_debt","verification","api_exposure","concurrency","state_flux","dead_code","spec_match","stability","churn","documentation","tabs_vs_spaces","algorithmic_dos","obscured_payload","logic_bomb","injection_surface","memory_corruption","secrets_risk"],"hit_vector":["branch","structural_boundaries","args","func_start","class_start","safety","safety_bypasses","high_risk_execution","io","api","state_mutation","dead_code","doc","test","concurrency","ui_framework","closures","globals","decorators","generics","comprehensions","scientific","reflection_metaprogramming","import","ownership","planned_debt","fragile_debt","spec_exposure","tabs_vs_spaces","ssr_boundaries","events","dependency_injection","macros","pointers","memory_alloc","inline_asm","telemetry","debug_prints","explicit_casts","panics_and_aborts","thread_sleeps","bitwise_ops","sync_locks","immutability_locks","cleanup","encapsulation","listeners","test_skip","indent_tabs","indent_spaces","hardware_bridge","cryptography","auth_middleware","ipc_rpc_bridges","feature_flags","serialization_parsing","regex_execution","time_date_logic","llm_api","llm_orchestrator","llm_vector_store","llm_local_compute","ml_traditional","dl_frameworks","lazy_evaluation","vectorized_math","core_var_decl","design_camel_case","design_snake_case","design_pascal_case","design_upper_case","design_short_vars","design_long_vars","duplicate_logic","orphaned_logic","lit_code_blocks","lit_diagrams","lit_headers","lit_links","sec_reflection_metaprogramming","sec_safety_bypasses","sec_io","sec_high_risk_execution","sec_state_mutation","sec_dead_code","sec_bitwise_ops","sec_shadow_imports","sec_homoglyphs","sec_hardcoded_secrets","sec_extension_mismatch","sec_entropy","sec_tainted_injection","prompt_injection","agentic_rce"],"satellites":["name","loc","branch","angle_x10","args","type_id","control_flow_x1000","mag_x10","start_line","end_line","docstring"],"scalars":{"exposure":1000,"physics":10},"lookups":{"languages":["json","python","plaintext"],"textures":["standard","crystalline","plates","digital","metallic","necrosis","io","check","verification","mutation","event","logic","high_risk_execution"],"authors":["Unknown Architect"],"proofs":["Single Indicator (Ext: .json)","Ecosystem Consensus Lock (83% Local Dominance)","Ecosystem Consensus Lock (75% Local Dominance)","Metadata Anchor (COPYING)"],"purposes":["Standard Logic Matrix"],"reasons":["Blocked (Unsupported Extension: '.lock')","Blocked (Unsupported Extension: '.toml')","Unsupported Format (.undeterminable)","Blocked (Unsupported Extension: '.rst')","Blocked (System Exclusion, Hidden Directory, or Dynamic Ignored Dir)"],"exts":[".lock",".toml","none",".rst",".yml",".yaml"],"imports":["nox","os","pathlib","tempfile","collections.abc","jsonschema_specifications","pytest","importlib.resources","importlib_resources","json","referencing","jsonschema_specifications._core","referencing.jsonschema"],"constellations":["jsonschema_specifications-2025.9.1/jsonschema_specifications/schemas/draft7","jsonschema_specifications-2025.9.1/jsonschema_specifications/schemas/draft6","jsonschema_specifications-2025.9.1/jsonschema_specifications/schemas/draft4","jsonschema_specifications-2025.9.1/jsonschema_specifications/schemas/draft3","jsonschema_specifications-2025.9.1/jsonschema_specifications/schemas/draft202012","jsonschema_specifications-2025.9.1/jsonschema_specifications/schemas/draft201909","jsonschema_specifications-2025.9.1","jsonschema_specifications-2025.9.1/jsonschema_specifications/tests","jsonschema_specifications-2025.9.1/jsonschema_specifications"],"archetypes":["file_cluster_8","file_cluster_13","Static: Literature & Documentation"]}},"session":{"engine":"GitGalaxy Scope vlatest (Delta Mode)","target":"jsonschema-specifications","timestamp":"2026-08-03T21:22:01.683150+00:00","duration_seconds":0.18,"target_directory":"/srv/storage_16tb/projects/gitgalaxy/data/pypi_top_200/jsonschema-specifications","git_audit":{"status":"Not a Git repository (or Git not installed)"},"missing_dependencies":{"networkx":false,"tiktoken":false,"xgboost":false,"pyyaml":false},"zero_dependency_mode":false}},"global_summary":{"summary":{"total_files":33,"verified_files":12,"total_loc":851,"dominant_language":"python","volatility_index":0.0,"Percent_Visible":36.4},"repo_macro_species":{"name":"Cluster 3","id":3,"z_score":6.01,"raw_drift":0.742},"unparsable_files":{"ambig_file_count":21,"size_limit":0,"binary":0,"unparsable":0,"os_permissions":0,"composition_by_extension_and_reason":{"no_extension":{"Unsupported Format (.undeterminable)":15,"Blocked (System Exclusion, Hidden Directory, or Dynamic Ignored Dir)":1},".yaml":{"Blocked (System Exclusion, Hidden Directory, or Dynamic Ignored Dir)":1},".yml":{"Blocked (System Exclusion, Hidden Directory, or Dynamic Ignored Dir)":1},".rst":{"Blocked (Unsupported Extension: '.rst')":1},".toml":{"Blocked (Unsupported Extension: '.toml')":1},".lock":{"Blocked (Unsupported Extension: '.lock')":1}},"breakdown":{"binary":0,"unparsable":0,"no_extension":0,"size_limit":0,"os_permissions":0,"Format [unknown]":{"count":16,"details":{"Unsupported Format (.undeterminable)":15,"Blocked (System Exclusion, Hidden Directory, or Dynamic Ignored Dir)":1}},"Format [.yaml]":{"count":1,"details":{"Blocked (System Exclusion, Hidden Directory, or Dynamic Ignored Dir)":1}},"Format [.yml]":{"count":1,"details":{"Blocked (System Exclusion, Hidden Directory, or Dynamic Ignored Dir)":1}},"Format [.rst]":{"count":1,"details":{"Blocked (Unsupported Extension: '.rst')":1}},"Format [.toml]":{"count":1,"details":{"Blocked (Unsupported Extension: '.toml')":1}},"Format [.lock]":{"count":1,"details":{"Blocked (Unsupported Extension: '.lock')":1}}}},"health":{"avg_cognitive_load":3.246,"avg_safety_score":0.497,"avg_tech_debt":6.265,"avg_documentation":33.688},"composition":{"plaintext":{"files":1,"loc":0,"impact":1.0},"python":{"files":5,"loc":144,"impact":176.8},"json":{"files":6,"loc":707,"impact":104.14000000000001}},"ecosystem_fingerprint":{"ml_clusters":{"file_cluster_8":{"count":8,"pct":66.7},"file_cluster_13":{"count":3,"pct":25.0}},"static_mass":{"Static: Literature & Documentation":{"count":1,"pct":8.3}}},"ai_topology":{"classification":"Non-AI / Traditional","insights":[]},"directory_groups":{"jsonschema_specifications-2025.9.1":{"file_count":2,"total_mass":94.44,"avg_exposures":{"cognitive_load":2.37,"safety_score":2.98,"tech_debt":37.59,"verification":40.0,"api_exposure":2.95,"concurrency":0.0,"state_flux":13.03,"dead_code":0.0,"spec_match":50.0,"stability":25.0,"churn":0.0,"documentation":44.96,"tabs_vs_spaces":75.0,"algorithmic_dos":49.8,"obscured_payload":0.0,"logic_bomb":50.0,"injection_surface":0.0,"memory_corruption":0.0,"secrets_risk":0.0}},"jsonschema_specifications-2025.9.1/jsonschema_specifications":{"file_count":2,"total_mass":57.06,"avg_exposures":{"cognitive_load":9.75,"safety_score":0.0,"tech_debt":0.0,"verification":2.38,"api_exposure":1.0,"concurrency":0.0,"state_flux":0.0,"dead_code":0.0,"spec_match":63.33,"stability":50.0,"churn":0.0,"documentation":63.33,"tabs_vs_spaces":75.0,"algorithmic_dos":24.22,"obscured_payload":0.0,"logic_bomb":0.0,"injection_surface":0.0,"memory_corruption":0.0,"secrets_risk":0.0}},"jsonschema_specifications-2025.9.1/jsonschema_specifications/tests":{"file_count":2,"total_mass":26.3,"avg_exposures":{"cognitive_load":3.6,"safety_score":0.0,"tech_debt":0.0,"verification":0.0,"api_exposure":2.21,"concurrency":0.0,"state_flux":0.0,"dead_code":0.0,"spec_match":53.33,"stability":50.0,"churn":0.0,"documentation":0.0,"tabs_vs_spaces":75.0,"algorithmic_dos":1.08,"obscured_payload":0.0,"logic_bomb":0.0,"injection_surface":0.0,"memory_corruption":0.0,"secrets_risk":0.0}},"jsonschema_specifications-2025.9.1/jsonschema_specifications/schemas/draft201909":{"file_count":1,"total_mass":15.82,"avg_exposures":{"cognitive_load":7.5,"safety_score":0.0,"tech_debt":0.0,"verification":2.3,"api_exposure":0.0,"concurrency":0.0,"state_flux":0.0,"dead_code":0.0,"spec_match":100.0,"stability":50.0,"churn":0.0,"documentation":60.8,"tabs_vs_spaces":100.0,"algorithmic_dos":0.0,"obscured_payload":0.0,"logic_bomb":0.0,"injection_surface":0.0,"memory_corruption":0.0,"secrets_risk":0.0}},"jsonschema_specifications-2025.9.1/jsonschema_specifications/schemas/draft202012":{"file_count":1,"total_mass":16.14,"avg_exposures":{"cognitive_load":0.0,"safety_score":0.0,"tech_debt":0.0,"verification":2.3,"api_exposure":0.0,"concurrency":0.0,"state_flux":0.0,"dead_code":0.0,"spec_match":100.0,"stability":50.0,"churn":0.0,"documentation":43.89,"tabs_vs_spaces":100.0,"algorithmic_dos":0.0,"obscured_payload":0.0,"logic_bomb":0.0,"injection_surface":0.0,"memory_corruption":0.0,"secrets_risk":0.0}},"jsonschema_specifications-2025.9.1/jsonschema_specifications/schemas/draft3":{"file_count":1,"total_mass":17.82,"avg_exposures":{"cognitive_load":0.0,"safety_score":0.0,"tech_debt":0.0,"verification":2.3,"api_exposure":0.0,"concurrency":0.0,"state_flux":0.0,"dead_code":0.0,"spec_match":100.0,"stability":50.0,"churn":0.0,"documentation":21.57,"tabs_vs_spaces":0.0,"algorithmic_dos":0.0,"obscured_payload":0.0,"logic_bomb":0.0,"injection_surface":0.0,"memory_corruption":0.0,"secrets_risk":0.0}},"jsonschema_specifications-2025.9.1/jsonschema_specifications/schemas/draft4":{"file_count":1,"total_mass":17.98,"avg_exposures":{"cognitive_load":0.0,"safety_score":0.0,"tech_debt":0.0,"verification":2.3,"api_exposure":0.0,"concurrency":0.0,"state_flux":0.0,"dead_code":0.0,"spec_match":100.0,"stability":50.0,"churn":0.0,"documentation":20.93,"tabs_vs_spaces":100.0,"algorithmic_dos":0.0,"obscured_payload":0.0,"logic_bomb":0.0,"injection_surface":0.0,"memory_corruption":0.0,"secrets_risk":0.0}},"jsonschema_specifications-2025.9.1/jsonschema_specifications/schemas/draft6":{"file_count":1,"total_mass":18.06,"avg_exposures":{"cognitive_load":0.0,"safety_score":0.0,"tech_debt":0.0,"verification":2.3,"api_exposure":0.0,"concurrency":0.0,"state_flux":0.0,"dead_code":0.0,"spec_match":100.0,"stability":50.0,"churn":0.0,"documentation":20.65,"tabs_vs_spaces":100.0,"algorithmic_dos":0.0,"obscured_payload":0.0,"logic_bomb":0.0,"injection_surface":0.0,"memory_corruption":0.0,"secrets_risk":0.0}},"jsonschema_specifications-2025.9.1/jsonschema_specifications/schemas/draft7":{"file_count":1,"total_mass":18.32,"avg_exposures":{"cognitive_load":0.0,"safety_score":0.0,"tech_debt":0.0,"verification":2.3,"api_exposure":0.0,"concurrency":0.0,"state_flux":0.0,"dead_code":0.0,"spec_match":100.0,"stability":50.0,"churn":0.0,"documentation":19.82,"tabs_vs_spaces":100.0,"algorithmic_dos":0.0,"obscured_payload":0.0,"logic_bomb":0.0,"injection_surface":0.0,"memory_corruption":0.0,"secrets_risk":0.0}}},"network_macro":{"modularity":0.0,"assortativity":0.0,"cyclic_density":0.0,"avg_path_length":1.0,"articulation_points":0},"ecosystem_audits":{"api_mapper":{"status":"no_swagger","shadow_count":0,"ghost_count":0},"xray":{"anomalies_found":0},"firewall":{"imports_whitelisted":0,"imports_unknown":14,"imports_blacklisted":0,"threats_found":1,"threats_allowed":0}},"typosquat_hits":0,"Global Architectural Fingerprint":{"Active Execution Logic (ML Clusters)":{"file_cluster_8":"66.7% (8 files)","file_cluster_13":"25.0% (3 files)"},"Static Assets (Static Categories)":{"Static: Literature & Documentation":"8.3% (1 files)"}},"Repository Ecosystem Baseline (Architecture)":{"Classification":"Cluster 3","Architectural Drift (Z-Score)":6.01}},"galaxy":{"names":["metaschema.json","metaschema.json","metaschema.json","metaschema.json","metaschema.json","metaschema.json","noxfile.py","test_jsonschema_specifications.py","__init__.py","_core.py","__init__.py","COPYING"],"paths":["jsonschema_specifications-2025.9.1/jsonschema_specifications/schemas/draft7/metaschema.json","jsonschema_specifications-2025.9.1/jsonschema_specifications/schemas/draft6/metaschema.json","jsonschema_specifications-2025.9.1/jsonschema_specifications/schemas/draft4/metaschema.json","jsonschema_specifications-2025.9.1/jsonschema_specifications/schemas/draft3/metaschema.json","jsonschema_specifications-2025.9.1/jsonschema_specifications/schemas/draft202012/metaschema.json","jsonschema_specifications-2025.9.1/jsonschema_specifications/schemas/draft201909/metaschema.json","jsonschema_specifications-2025.9.1/noxfile.py","jsonschema_specifications-2025.9.1/jsonschema_specifications/tests/test_jsonschema_specifications.py","jsonschema_specifications-2025.9.1/jsonschema_specifications/tests/__init__.py","jsonschema_specifications-2025.9.1/jsonschema_specifications/_core.py","jsonschema_specifications-2025.9.1/jsonschema_specifications/__init__.py","jsonschema_specifications-2025.9.1/COPYING"],"lang_ids":[0,0,0,0,0,0,1,1,1,1,1,2],"locs":[167,154,150,173,59,43,150,42,1,39,13,20],"m_locs":[166,153,149,141,57,41,97,24,0,19,4,0],"d_locs":[0,0,0,0,0,0,26,5,0,13,5,16],"mass":[183,181,180,178,161,158,934,158,105,440,131,10],"author_distribution":[0,0,0,0,0,0,0,0,0,0,0,0],"ownership_entropy":[0,0,0,0,0,0,0,0,0,0,0,0],"raw_churn_freq":[0,0,0,0,0,0,0,0,0,0,0,0],"cog_raw":[0,0,0,0,0,122,186,167,2000,526,500,0],"pos_x":[758,13737,-3503,-14691,3481,16044,8811,-9635,-11824,-516,-2634,6561],"pos_y":[-981,-2168,1696,1400,135,-530,1825,-629,-413,-1381,-2409,2560],"pos_z":[-10170,1310,13567,-4752,-13900,4643,-1066,118,2436,8466,13178,2598],"risks_flat":[0,0,0,22,0,0,0,0,1000,500,0,198,1000,0,0,0,0,0,0,0,0,0,22,0,0,0,0,1000,500,0,206,1000,0,0,0,0,0,0,0,0,0,22,0,0,0,0,1000,500,0,209,1000,0,0,0,0,0,0,0,0,0,22,0,0,0,0,1000,500,0,215,0,0,0,0,0,0,0,0,0,0,22,0,0,0,0,1000,500,0,438,1000,0,0,0,0,0,0,75,0,0,22,0,0,0,0,1000,500,0,608,1000,0,0,0,0,0,0,47,59,751,800,59,0,260,0,1000,500,0,899,1000,996,0,1000,0,0,0,22,0,0,0,44,0,0,0,1000,500,0,0,1000,21,0,0,0,0,0,50,0,0,0,0,0,0,0,66,500,0,0,500,0,0,0,0,0,0,145,0,0,41,12,0,0,0,1000,500,0,999,1000,484,0,0,0,0,0,50,0,0,6,7,0,0,0,266,500,0,266,500,0,0,0,0,0,0,-10,-10,-10,-10,-10,-10,-10,-10,-10,-10,-10,-10,-10,-10,-10,-10,-10,-10,-10],"hits_flat":[0,0,0,0,0,0,0,0,0,0,0,0,0,0,0,0,0,0,0,0,0,0,0,0,0,0,0,0,0,0,0,0,0,0,0,0,0,0,0,0,0,0,0,0,0,0,0,0,0,164,0,0,0,0,0,0,0,0,0,0,0,0,0,0,0,0,0,0,0,0,0,0,0,0,0,0,0,0,0,0,0,0,0,0,0,0,0,0,0,0,0,0,0,0,0,0,0,0,0,0,0,0,0,0,0,0,0,0,0,0,0,0,0,0,0,0,0,0,0,0,0,0,0,0,0,0,0,0,0,0,0,0,0,0,0,0,0,0,0,0,0,0,0,151,0,0,0,0,0,0,0,0,0,0,0,0,0,0,0,0,0,0,0,0,0,0,0,0,0,0,0,0,0,0,0,0,0,0,0,0,0,0,0,0,0,0,0,0,0,0,0,0,0,0,0,0,0,0,0,0,0,0,0,0,0,0,0,0,0,0,0,0,0,0,0,0,0,0,0,0,0,0,0,0,0,0,0,0,0,0,0,0,0,0,0,0,0,147,0,0,0,0,0,0,0,0,0,0,0,0,0,0,0,0,0,0,0,0,0,0,0,0,0,0,0,0,0,0,0,0,0,0,0,0,0,0,0,0,0,0,0,0,0,0,0,0,0,0,0,0,0,0,0,0,0,0,0,0,0,0,0,0,0,0,0,0,0,0,0,0,0,0,0,0,0,0,0,0,0,0,0,0,0,0,0,0,0,0,0,0,139,0,0,0,0,0,0,0,0,0,0,0,0,0,0,0,0,0,0,0,0,0,0,0,0,0,0,0,0,0,0,0,0,0,0,0,0,0,0,0,0,0,0,0,0,0,0,0,0,0,0,0,0,0,0,0,0,0,0,0,0,0,0,0,0,0,0,0,0,0,0,0,0,0,0,0,0,0,0,0,0,0,0,0,0,0,0,0,0,0,0,0,0,0,0,55,0,0,0,0,0,0,0,0,0,0,0,0,0,0,0,0,0,0,0,0,0,0,0,0,0,0,0,0,0,0,0,0,0,0,0,0,0,0,0,0,0,0,0,0,0,0,0,0,0,0,0,0,0,0,0,0,0,0,0,0,0,0,0,0,0,0,0,0,0,0,0,0,0,0,0,0,0,0,0,0,0,0,0,0,0,0,0,0,0,0,0,0,0,39,0,0,0,0,0,0,0,0,0,0,0,0,0,0,0,0,0,0,0,0,0,0,0,0,0,0,0,0,0,0,0,0,0,0,0,0,0,0,0,0,0,0,0,0,10,20,10,10,0,0,1,0,2,9,3,0,16,3,0,0,0,1,9,0,2,0,0,4,0,0,0,0,0,0,0,0,0,0,0,0,0,0,2,0,0,0,0,0,0,5,0,0,0,62,0,0,0,0,0,0,0,0,0,0,0,0,0,0,0,9,0,0,0,0,0,0,0,0,3,0,0,0,0,0,0,0,0,0,0,0,0,0,0,0,0,0,0,0,2,15,3,3,0,7,0,0,1,3,0,0,2,9,0,0,0,0,1,0,0,0,0,5,0,0,0,0,0,0,0,0,0,0,0,0,0,0,1,0,0,0,0,0,0,2,0,0,0,15,0,0,0,0,0,0,0,0,0,0,0,0,0,0,0,1,0,0,0,0,0,0,0,0,3,0,0,0,0,0,0,0,4,0,0,0,0,0,0,0,0,0,0,0,0,0,0,0,0,0,0,0,0,0,0,0,0,0,0,0,0,0,0,0,0,0,0,0,0,0,0,0,0,0,0,0,0,0,0,0,0,0,0,0,0,0,0,0,0,0,0,0,0,0,0,0,0,0,0,0,0,0,0,0,0,0,0,0,0,0,0,0,0,0,0,0,0,0,0,0,0,0,0,0,0,0,0,0,0,0,0,0,0,0,0,0,0,0,8,10,1,1,0,2,0,0,0,1,0,0,4,0,0,0,0,0,0,0,0,0,0,4,0,0,0,0,0,0,0,0,0,0,0,0,0,0,0,0,0,0,0,0,0,2,0,0,0,14,0,0,0,0,0,0,0,0,0,0,0,0,0,0,1,0,0,0,0,0,0,0,0,0,0,0,0,0,0,0,0,0,0,0,0,0,0,0,0,0,0,0,0,0,0,5,0,0,0,0,0,0,0,1,0,0,2,0,0,0,0,0,0,0,0,0,0,2,0,0,0,0,0,0,0,0,0,0,0,0,0,0,0,0,0,0,0,0,0,6,0,0,0,0,0,0,0,0,0,0,0,0,0,0,0,0,0,0,0,1,0,0,0,0,0,0,0,0,0,0,0,0,0,0,0,0,0,0,0,0,0,0,0,0,0,0,0,0,0,0,0,0,0,0,0,0,0,0,0,0,0,0,0,0,0,0,0,0,0,0,0,0,0,0,0,0,0,0,0,0,0,0,0,0,0,0,0,0,0,0,0,0,0,0,0,0,0,0,0,0,0,0,0,0,0,0,0,0,0,0,0,0,0,0,0,0,0,0,0,0,0,0,0,0,0,0,0,0,0,0,0,0,0,0,0,0,0,0,0,0,0,0],"tel_aid":[0,0,0,0,0,0,0,0,0,0,0,0],"tel_pid":[0,0,0,0,0,0,1,2,2,2,2,3],"tel_purp":[0,0,0,0,0,0,0,0,0,0,0,0],"tel_lt":[2,2,2,2,2,2,1.5,1.5,1.5,1.5,1.5,1],"tel_pop":[0,0,0,0,0,0,0,0,0,1,0,0],"tel_cfr":[0,0,0,0,0,0,333,118,0,444,0,0],"ai_threats":[0,0,0,0,0,0,98850,98830,98840,98960,98840,0],"satellite_data_flat":["docs",20,3,495,2,0,600,287,92,111,"session",7,1,765,3,10,200,164,26,32,"requirements",13,3,393,2,0,750,110,127,139,"build",7,1,675,2,0,333,107,53,59,"audit",5,0,900,2,0,0,37,45,49,"docs_style",9,0,900,2,0,0,30,115,123,"tests",6,0,900,2,8,0,20,36,41,"style",5,0,900,2,0,0,20,63,67,"typing",5,0,900,2,0,0,20,71,75,"test_it_copes_with_dotfiles",14,2,562,2,8,500,85,24,37,"test_it_contains_metaschemas",5,0,900,2,10,0,20,9,13,"test_it_is_crawled",2,0,900,2,7,0,18,16,17,"_schemas",21,7,427,2,0,700,426,16,36],"satellite_offsets":[0,0,0,0,0,0,0,9,12,12,13,13,13],"imports":[[],[],[],[],[],[],[0,1,2,3],[4,5,2,6],[],[7,8,9,10],[11,12],[]],"c_ids":[0,1,2,3,4,5,6,7,7,8,8,6],"a_ids":[[0],[0],[0],[0],[0],[0],[0,1],[1,0],[0],[1,0],[1,0],[2]],"a_dists":[[4447],[4447],[4447],[4447],[4447],[4447],[9394,9477],[11702,12054],[4447],[9385,9839],[8480,9071],[0]],"edges":[[],[],[],[],[],[],[],[],[],[],[],[]],"outbound_edges":[[],[],[],[],[],[],[],[],[],[],[],[]]},"singularity":{"paths":["jsonschema_specifications-2025.9.1/uv.lock","jsonschema_specifications-2025.9.1/pyproject.toml","jsonschema_specifications-2025.9.1/jsonschema_specifications/schemas/draft202012/vocabularies/validation","jsonschema_specifications-2025.9.1/jsonschema_specifications/schemas/draft202012/vocabularies/unevaluated","jsonschema_specifications-2025.9.1/jsonschema_specifications/schemas/draft202012/vocabularies/meta-data","jsonschema_specifications-2025.9.1/jsonschema_specifications/schemas/draft202012/vocabularies/format-assertion","jsonschema_specifications-2025.9.1/jsonschema_specifications/schemas/draft202012/vocabularies/format-annotation","jsonschema_specifications-2025.9.1/jsonschema_specifications/schemas/draft202012/vocabularies/core","jsonschema_specifications-2025.9.1/jsonschema_specifications/schemas/draft202012/vocabularies/content","jsonschema_specifications-2025.9.1/jsonschema_specifications/schemas/draft202012/vocabularies/applicator","jsonschema_specifications-2025.9.1/jsonschema_specifications/schemas/draft201909/vocabularies/validation","jsonschema_specifications-2025.9.1/jsonschema_specifications/schemas/draft201909/vocabularies/meta-data","jsonschema_specifications-2025.9.1/jsonschema_specifications/schemas/draft201909/vocabularies/format","jsonschema_specifications-2025.9.1/jsonschema_specifications/schemas/draft201909/vocabularies/core","jsonschema_specifications-2025.9.1/jsonschema_specifications/schemas/draft201909/vocabularies/content","jsonschema_specifications-2025.9.1/jsonschema_specifications/schemas/draft201909/vocabularies/applicator","jsonschema_specifications-2025.9.1/README.rst","jsonschema_specifications-2025.9.1/PKG-INFO","jsonschema_specifications-2025.9.1/.readthedocs.yml","jsonschema_specifications-2025.9.1/.pre-commit-config.yaml","jsonschema_specifications-2025.9.1/.gitignore"],"exts":[0,1,2,2,2,2,2,2,2,2,2,2,2,2,2,2,3,2,4,5,2],"reasons":[0,1,2,2,2,2,2,2,2,2,2,2,2,2,2,2,3,2,4,4,4],"sizes":[52741,4884,0,0,0,0,0,0,0,0,0,0,0,0,0,0,1215,0,224,813,3139],"confidences":[0,0,400,400,400,400,400,400,400,400,400,400,400,400,400,400,0,400,0,0,0]},"story":{"status":"","why":"","who":"","significance":"","link":"","artifacts":[{"title":"","url":"","description":""}]}}

v2.4.6/propcache/propcache_galaxy_llm.md

### 3. `propcache-0.4.1/packaging/pep517_backend/_cython_configuration.py` (PYTHON) -> Cumulative Risk: **515.17**

- **Archetype:** `file_cluster_13` (Distance: 11.636 IQR)
- **Magnitude:** 49.34 | **LOC:** 128 | **CtrlFlow:** 15.2% | **Authorship Centralization:** 0.0%
- **Primary Risk Drivers:** Spec Match (100.0%), Algorithmic Dos (100.0%), State Flux (99.5411%), Logic Bomb (82.6532%)
- **Heaviest Functions:** `patched_env` (Impact: 20.9), `_configure_cython_line_tracing` (Impact: 7.2), `make_cythonize_cli_args_from_config` (Impact: 2.3)

### 4. `propcache-0.4.1/packaging/pep517_backend/_backend.py` (PYTHON) -> Cumulative Risk: **453.96**

- **Archetype:** `file_cluster_13` (Distance: 9.367 IQR)
- **Magnitude:** 76.62 | **LOC:** 392 | **CtrlFlow:** 27.8% | **Authorship Centralization:** 0.0%
- **Primary Risk Drivers:** Spec Match (100.0%), Algorithmic Dos (99.7226%), Logic Bomb (82.201%), Verification (80.0%)
- **Heaviest Functions:** `_in_temporary_directory` (Impact: 15.8), `patched_dist_get_long_description` (Impact: 8.6), `patched_distutils_cmd_install` (Impact: 8.5)

### 6. `propcache-0.4.1/tests/test_cached_property.py` (PYTHON) -> Cumulative Risk: **359.06**

- **Archetype:** `file_cluster_16` (Distance: 12.521 IQR)
- **Magnitude:** 116.2 | **LOC:** 227 | **CtrlFlow:** 17.2% | **Authorship Centralization:** 0.0%
- **Primary Risk Drivers:** Spec Match (100.0%), Algorithmic Dos (100.0%), Logic Bomb (100.0%), Stability (50.0%)
- **Heaviest Functions:** `test_cached_property_no_refcount_leak` (Impact: 16.0), `test_set_name` (Impact: 15.8), `test_get_without_set_name` (Impact: 15.7)

### 7. `propcache-0.4.1/tests/test_under_cached_property.py` (PYTHON) -> Cumulative Risk: **358.73**

- **Archetype:** `file_cluster_16` (Distance: 12.012 IQR)
- **Magnitude:** 109.1 | **LOC:** 253 | **CtrlFlow:** 12.4% | **Authorship Centralization:** 0.0%
- **Primary Risk Drivers:** Spec Match (100.0%), Algorithmic Dos (100.0%), Logic Bomb (100.0%), Stability (50.0%)
- **Heaviest Functions:** `test_under_cached_property_no_refcount_l` (Impact: 16.1), `test_under_cached_property_typeddict` (Impact: 13.3), `test_under_cached_property` (Impact: 13.0)

### 8. `propcache-0.4.1/tests/test_benchmarks.py` (PYTHON) -> Cumulative Risk: **270.04**

- **Archetype:** `file_cluster_16` (Distance: 12.231 IQR)
- **Magnitude:** 56.22 | **LOC:** 93 | **CtrlFlow:** 16.1% | **Authorship Centralization:** 0.0%
- **Primary Risk Drivers:** Spec Match (100.0%), Algorithmic Dos (100.0%), Stability (50.0%), Cognitive Load (7.8272%)
- **Heaviest Functions:** `test_under_cached_property_cache_miss` (Impact: 9.1), `test_under_cached_property_cache_hit` (Impact: 9.0), `test_cached_property_cache_hit` (Impact: 9.0)