v2.7.0/Correios-Brasil/Correios-Brasil_galaxy_gpu.json

{"meta":{"zero_dependency_mode":false,"missing_dependencies":{"networkx":false,"tiktoken":false,"xgboost":false,"pyyaml":false},"schemas":{"galaxy_columns":["names","paths","lang_ids","locs","m_locs","d_locs","mass","author_distribution","ownership_entropy","raw_churn_freq","cog_raw","pos_x","pos_y","pos_z","risks_flat","hits_flat","tel_aid","tel_pid","tel_purp","tel_lt","tel_pop","tel_cfr","ai_threats","satellite_data_flat","satellite_offsets","imports","c_ids","a_ids","a_dists","edges","outbound_edges"],"singularity_columns":["paths","exts","reasons","sizes","confidences"],"risk_vector_x1000":["cognitive_load","safety_score","tech_debt","verification","api_exposure","concurrency","state_flux","dead_code","spec_match","stability","churn","documentation","secrets_risk"],"hit_vector":["branch","structural_boundaries","args","func_start","class_start","safety","safety_bypasses","high_risk_execution","io","api","state_mutation","dead_code","doc","test","concurrency","ui_framework","closures","globals","decorators","generics","comprehensions","scientific","reflection_metaprogramming","import","ownership","planned_debt","fragile_debt","spec_exposure","ssr_boundaries","events","dependency_injection","macros","pointers","memory_alloc","inline_asm","telemetry","debug_prints","explicit_casts","panics_and_aborts","thread_sleeps","bitwise_ops","sync_locks","immutability_locks","cleanup","encapsulation","listeners","test_skip","indent_tabs","indent_spaces","hardware_bridge","cryptography","auth_middleware","ipc_rpc_bridges","feature_flags","serialization_parsing","regex_execution","time_date_logic","llm_api","llm_orchestrator","llm_vector_store","llm_local_compute","ml_traditional","dl_frameworks","lazy_evaluation","vectorized_math","core_var_decl","design_camel_case","design_snake_case","design_pascal_case","design_upper_case","design_short_vars","design_long_vars","duplicate_logic","unreferenced_by_name","lit_code_blocks","lit_diagrams","lit_headers","lit_links","sec_reflection_metaprogramming","sec_safety_bypasses","sec_io","sec_high_risk_execution","sec_state_mutation","sec_dead_code","sec_bitwise_ops","sec_shadow_imports","sec_homoglyphs","sec_hardcoded_secrets","sec_extension_mismatch","sec_entropy","sec_tainted_injection","prompt_injection","agentic_rce","sec_unicode_steganography","sec_self_propagation"],"satellites":["name","loc","branch","angle_x10","args","type_id","control_flow_x1000","mag_x10","start_line","end_line","docstring"],"scalars":{"exposure":1000,"physics":10},"lookups":{"languages":["json","javascript","plaintext","typescript","markdown"],"textures":["standard","crystalline","plates","digital","metallic","necrosis","io","check","verification","mutation","event","logic","high_risk_execution"],"authors":["Unknown Architect"],"proofs":["Single Indicator (Ext: .json)","Single Indicator (Ext: .js)","Prose Extension (.txt)","Single Indicator (Exact Match)","Single Indicator (Ext: .ts)","Prose Extension (.md)"],"purposes":["Standard Logic Matrix"],"reasons":["Blocked (Unsupported Extension: '.lock')","Blocked (Saturation: Line 2 exceeds 500 chars)","Blocked (System Exclusion, Hidden Directory, or Dynamic Ignored Dir)"],"exts":[".lock",".xml","none",".js"],"imports":["./package.json","@rollup/plugin-commonjs","@rollup/plugin-node-resolve","@rollup/plugin-typescript","rollup-plugin-dts","rollup-plugin-terser","../lib","../lib/utils/parser","../lib/utils/validation","chai","fs","path","axios","http","https","iconv-lite","xml-js","./features/cep","./features/precos","./features/rastreio","../utils/URL","../utils/request","crypto","../interfaces","../utils/parser","../utils/validation"],"constellations":["__monolith__","tests/static","tests","lib/utils","lib","lib/features"],"archetypes":["Unclassified","Static: Literature & Documentation"]}},"session":{"engine":"GitGalaxy Scope vlatest (Delta Mode)","target":"Correios-Brasil","timestamp":"2026-09-13T17:43:51.454022+00:00","duration_seconds":0.08,"target_directory":"/srv/storage_16tb/projects/gitgalaxy/data/Correios-Brasil","git_audit":{"branch":"master","commit_hash":"03eef682886174627cc559163a25b7180c642e54","remote_url":"https://github.com/FinotiLucas/Correios-Brasil.git","latest_commit_date":"2023-07-11T21:30:01-03:00"},"missing_dependencies":{"networkx":false,"tiktoken":false,"xgboost":false,"pyyaml":false},"zero_dependency_mode":false}},"global_summary":{"summary":{"total_files":25,"verified_files":17,"total_loc":443,"dominant_language":"typescript","volatility_index":0.0,"Percent_Visible":68.0},"repo_macro_species":{"name":"Cluster 3","id":3,"z_score":2.272,"raw_drift":0.414},"unparsable_files":{"ambig_file_count":8,"size_limit":0,"binary":0,"unparsable":0,"os_permissions":0,"composition_by_extension_and_reason":{"no_extension":{"Blocked (System Exclusion, Hidden Directory, or Dynamic Ignored Dir)":5},".js":{"Blocked (System Exclusion, Hidden Directory, or Dynamic Ignored Dir)":1},".xml":{"Blocked (Saturation: Line 2 exceeds 500 chars)":1},".lock":{"Blocked (Unsupported Extension: '.lock')":1}},"breakdown":{"binary":0,"unparsable":0,"no_extension":0,"size_limit":0,"os_permissions":0,"Format [unknown]":{"count":5,"details":{"Blocked (System Exclusion, Hidden Directory, or Dynamic Ignored Dir)":5}},"Format [.js]":{"count":1,"details":{"Blocked (System Exclusion, Hidden Directory, or Dynamic Ignored Dir)":1}},"Format [.xml]":{"count":1,"details":{"Blocked (Saturation: Line 2 exceeds 500 chars)":1}},"Format [.lock]":{"count":1,"details":{"Blocked (Unsupported Extension: '.lock')":1}}}},"health":{"avg_cognitive_load":5.776,"avg_safety_score":24.716,"avg_tech_debt":5.88,"avg_documentation":41.176},"composition":{"markdown":{"files":1,"loc":0,"impact":7.54},"typescript":{"files":11,"loc":382,"impact":216.41000000000003},"plaintext":{"files":2,"loc":0,"impact":12.42},"javascript":{"files":2,"loc":40,"impact":31.299999999999997},"json":{"files":1,"loc":21,"impact":15.42}},"ecosystem_fingerprint":{"ml_clusters":{"Unclassified":{"count":14,"pct":82.4}},"static_mass":{"Static: Literature & Documentation":{"count":3,"pct":17.6}}},"ai_topology":{"classification":"Non-AI / Traditional","insights":[]},"directory_groups":{"__monolith__":{"file_count":5,"total_mass":55.96,"avg_exposures":{"cognitive_load":1.1,"safety_score":12.91,"tech_debt":0.0,"verification":1.38,"api_exposure":1.41,"concurrency":0.0,"state_flux":3.36,"dead_code":4.63,"spec_match":0.0,"stability":0.0,"churn":0.0,"documentation":0.0,"secrets_risk":0.0}},"lib/features":{"file_count":3,"total_mass":78.02,"avg_exposures":{"cognitive_load":20.23,"safety_score":75.15,"tech_debt":0.0,"verification":2.41,"api_exposure":18.08,"concurrency":77.49,"state_flux":38.93,"dead_code":0.0,"spec_match":100.0,"stability":0.0,"churn":0.0,"documentation":100.0,"secrets_risk":0.0}},"lib":{"file_count":2,"total_mass":34.28,"avg_exposures":{"cognitive_load":4.99,"safety_score":0.0,"tech_debt":0.0,"verification":2.3,"api_exposure":27.94,"concurrency":0.0,"state_flux":0.0,"dead_code":0.0,"spec_match":50.0,"stability":0.0,"churn":0.0,"documentation":0.0,"secrets_risk":0.0}},"lib/utils":{"file_count":5,"total_mass":46.58,"avg_exposures":{"cognitive_load":4.4,"safety_score":26.03,"tech_debt":19.99,"verification":2.36,"api_exposure":19.5,"concurrency":10.67,"state_flux":0.0,"dead_code":0.0,"spec_match":100.0,"stability":0.0,"churn":0.0,"documentation":80.0,"secrets_risk":0.0}},"tests":{"file_count":1,"total_mass":57.53,"avg_exposures":{"cognitive_load":0.0,"safety_score":0.0,"tech_debt":0.0,"verification":0.0,"api_exposure":0.0,"concurrency":53.33,"state_flux":0.0,"dead_code":0.0,"spec_match":100.0,"stability":0.0,"churn":0.0,"documentation":0.0,"secrets_risk":0.0}},"tests/static":{"file_count":1,"total_mass":10.72,"avg_exposures":{"cognitive_load":0.0,"safety_score":0.0,"tech_debt":0.0,"verification":0.0,"api_exposure":0.0,"concurrency":0.0,"state_flux":0.0,"dead_code":0.0,"spec_match":0.0,"stability":0.0,"churn":0.0,"documentation":0.0,"secrets_risk":0.0}}},"network_macro":{"modularity":0.2439,"assortativity":0.313,"cyclic_density":0.0,"avg_path_length":1.8667,"articulation_points":0},"ecosystem_audits":{"api_mapper":{"status":"no_swagger","shadow_count":0,"ghost_count":0},"xray":{"anomalies_found":1},"firewall":{"imports_whitelisted":0,"imports_unknown":14,"imports_blacklisted":0,"threats_found":0,"threats_allowed":0}},"typosquat_hits":0,"Global Architectural Fingerprint":{"Active Execution Logic (ML Clusters)":{"Unclassified":"82.4% (14 files)"},"Static Assets (Static Categories)":{"Static: Literature & Documentation":"17.6% (3 files)"}},"Repository Ecosystem Baseline (Architecture)":{"Classification":"Cluster 3","Architectural Drift (Z-Score)":2.272}},"galaxy":{"names":["tsconfig.json","rollup.config.js","prettier.config.js","rastreio.txt","package.json","utils.spec.ts","validation.ts","request.ts","parser.ts","formatter.ts","URL.ts","interfaces.ts","index.ts","rastreio.ts","precos.ts","cep.ts","README.md"],"paths":["tsconfig.json","rollup.config.js","prettier.config.js","tests/static/rastreio.txt","package.json","tests/utils.spec.ts","lib/utils/validation.ts","lib/utils/request.ts","lib/utils/parser.ts","lib/utils/formatter.ts","lib/utils/URL.ts","lib/interfaces.ts","lib/index.ts","lib/features/rastreio.ts","lib/features/precos.ts","lib/features/cep.ts","README.md"],"lang_ids":[0,1,1,2,2,3,3,3,3,3,3,3,3,3,3,3,4],"locs":[22,43,6,536,85,81,9,27,16,68,11,64,6,122,84,33,377],"m_locs":[21,35,5,0,0,43,7,24,12,42,9,60,4,89,71,21,0],"d_locs":[0,6,0,396,84,22,0,0,0,20,0,0,0,20,5,8,269],"mass":[154,167,146,107,17,575,42,58,48,160,157,212,131,412,309,59,75],"author_distribution":[0,0,0,0,0,0,0,0,0,0,0,0,0,0,0,0,0],"ownership_entropy":[0,0,0,0,0,0,0,0,0,0,0,0,0,0,0,0,0],"raw_churn_freq":[0,0,0,0,0,0,0,0,0,0,0,0,0,0,0,0,0],"cog_raw":[0,40,0,0,0,0,20,220,0,0,20,200,0,854,380,140,0],"pos_x":[7853,9668,10179,-3182,5722,16626,-4441,-110,1936,-907,-2505,1173,-1075,-10201,-12371,-10265,12978],"pos_y":[-1647,-1141,-853,-1443,-1404,901,2733,1358,3284,2677,3272,1780,2742,2099,2329,2833,-1123],"pos_z":[2840,1750,-4202,15732,-1161,1889,9650,6592,14962,9529,12050,-11403,-6461,-1749,2731,-4014,3077],"risks_flat":[0,0,0,22,0,0,0,0,0,0,0,0,0,55,0,0,22,35,0,0,231,0,0,0,0,0,0,645,0,22,35,0,167,0,0,0,0,0,0,-10,-10,-10,-10,-10,-10,-10,-10,-10,-10,-10,-10,-10,-10,-10,-10,-10,-10,-10,-10,-10,-10,-10,-10,-10,-10,0,0,0,0,0,533,0,0,1000,0,0,0,0,53,0,0,23,225,0,0,0,1000,0,0,1000,0,112,696,0,23,225,533,0,0,1000,0,0,1000,0,0,605,0,23,215,0,0,0,1000,0,0,1000,0,0,0,999,24,84,0,0,0,1000,0,0,1000,0,53,0,0,22,225,0,0,0,1000,0,0,0,0,99,0,0,22,523,0,0,0,1000,0,0,0,0,0,0,0,22,35,0,0,0,0,0,0,0,0,399,818,0,23,164,999,838,0,1000,0,0,1000,0,159,804,0,25,177,791,329,0,1000,0,0,1000,0,48,631,0,23,200,533,0,0,1000,0,0,1000,0,-10,-10,-10,-10,-10,-10,-10,-10,-10,-10,-10,-10,-10],"hits_flat":[0,0,0,0,0,0,0,0,0,0,0,0,0,0,0,0,0,0,0,0,0,0,0,0,0,0,0,0,0,0,0,0,0,0,0,0,0,0,0,0,0,0,0,0,0,0,0,0,19,0,0,0,0,0,0,0,0,0,0,0,0,0,0,0,0,0,0,0,0,0,0,0,0,0,0,0,0,0,0,0,0,0,0,0,0,0,0,0,0,0,0,0,0,0,0,2,6,0,0,0,0,0,0,0,1,0,1,0,0,0,0,0,0,3,0,0,0,0,5,0,0,0,0,0,0,3,0,0,0,0,0,0,0,0,0,0,0,0,0,0,0,0,0,28,0,0,0,0,0,0,0,0,0,0,0,0,0,0,0,0,0,0,0,0,0,0,0,0,0,0,0,0,0,0,0,0,0,0,0,0,0,0,0,0,0,0,0,0,0,0,0,0,0,0,0,0,0,0,0,1,1,0,0,0,0,0,0,0,0,0,0,0,0,0,0,0,0,0,0,0,0,0,0,0,0,0,0,0,0,0,0,0,0,0,0,0,0,0,3,0,0,0,0,0,0,0,0,0,0,0,0,0,0,0,0,0,0,0,0,0,0,0,0,0,0,0,0,0,0,0,0,0,0,0,0,0,0,0,0,0,0,0,0,0,0,0,0,0,0,0,0,0,0,0,0,0,0,0,0,0,0,0,0,0,0,0,0,0,0,0,0,0,0,0,0,0,0,0,0,0,0,0,0,0,0,0,0,0,0,0,0,0,0,0,0,0,0,0,0,0,0,0,0,0,0,0,0,0,0,0,0,0,0,0,0,0,0,0,0,0,0,0,0,0,0,0,0,0,0,0,0,0,0,0,0,0,0,0,0,0,0,0,0,0,0,0,0,0,0,0,0,0,0,0,0,0,0,0,0,0,0,0,0,0,0,0,0,0,0,0,0,0,0,0,0,0,0,0,0,0,0,0,0,0,0,0,0,0,0,0,0,0,0,0,0,0,0,0,0,0,0,0,0,0,0,0,0,0,0,0,0,0,0,0,0,0,0,0,0,0,0,0,0,0,0,0,0,0,0,0,0,0,0,0,0,0,16,10,1,0,0,0,0,6,0,0,0,0,17,2,0,10,0,0,0,0,0,0,6,0,0,0,0,0,0,0,0,0,0,0,0,0,0,1,0,0,0,0,0,0,0,0,0,30,0,0,0,0,0,0,0,0,0,0,0,0,0,0,0,0,6,4,2,0,0,0,0,0,0,0,0,0,0,0,0,0,0,0,0,0,0,0,0,0,0,0,0,0,0,0,1,2,1,1,0,0,0,0,0,1,0,0,0,0,0,0,0,0,0,0,0,0,0,0,0,0,0,0,0,0,0,0,0,0,0,0,0,0,1,0,1,0,0,0,0,0,0,0,4,0,0,0,0,0,0,2,0,0,0,0,0,0,0,0,0,2,1,1,0,0,0,0,0,0,0,0,0,0,0,0,0,0,0,0,0,0,0,0,0,0,0,0,0,0,0,5,10,4,1,1,1,3,0,9,1,0,0,0,0,2,0,3,0,0,0,0,0,0,3,0,0,0,0,0,0,2,0,0,0,0,0,0,0,0,0,0,0,0,0,0,0,0,0,16,0,0,0,0,0,0,0,0,0,0,0,0,0,0,0,0,0,0,0,0,0,0,0,0,0,0,0,0,0,0,0,0,0,0,0,0,0,0,0,0,0,0,0,0,0,0,0,5,2,2,0,0,1,0,0,1,0,0,0,0,0,0,0,0,0,0,0,0,0,2,0,0,0,0,0,0,0,0,0,0,0,0,0,0,0,0,0,0,0,0,0,0,0,0,4,0,0,0,0,0,1,0,0,0,0,0,0,0,0,0,0,0,0,0,0,0,0,0,0,0,0,0,0,0,0,0,0,0,0,0,0,0,0,0,0,0,0,0,0,0,0,0,10,5,5,0,0,0,0,0,5,0,0,5,0,0,0,0,0,0,0,0,0,0,0,0,0,0,0,0,0,0,0,0,0,0,0,0,0,0,0,0,0,0,0,0,0,0,0,32,0,0,0,0,0,0,17,0,0,0,0,0,0,0,0,0,5,0,5,0,0,0,0,0,5,0,0,0,0,0,0,0,0,0,0,0,0,0,0,0,0,0,0,0,0,0,1,2,0,0,1,0,0,0,6,1,0,0,0,0,0,0,0,0,0,0,0,0,0,0,0,0,0,0,0,0,0,0,0,0,0,0,0,0,0,0,0,0,0,0,0,0,0,0,6,0,0,0,0,0,0,0,0,0,0,0,0,0,0,0,0,6,0,0,0,6,0,0,0,0,0,0,0,0,0,0,0,0,0,0,0,0,0,0,0,0,0,0,0,0,0,12,10,0,0,5,0,0,0,0,5,0,0,0,0,0,0,0,0,0,0,0,0,0,0,0,0,0,0,0,0,0,0,0,0,0,0,0,0,0,0,0,0,0,0,0,0,0,0,50,0,0,0,0,0,0,0,0,0,0,0,0,0,0,0,0,0,0,0,0,0,0,0,0,0,0,0,0,0,0,0,0,0,0,0,0,0,0,0,0,0,0,0,0,0,0,0,4,0,0,0,0,0,0,0,1,0,0,0,0,0,0,0,0,0,0,0,0,0,3,0,0,0,0,0,0,0,0,0,0,0,0,0,0,0,0,0,0,0,0,0,0,0,0,0,0,0,0,0,0,0,0,0,0,0,0,0,0,0,0,0,0,0,0,0,0,0,0,0,0,0,0,0,0,0,0,0,0,0,0,0,0,0,0,0,0,0,0,0,0,0,4,21,12,3,0,3,7,0,0,1,7,0,3,0,8,0,7,0,0,0,1,0,0,3,0,0,0,0,0,0,5,0,0,0,0,0,0,0,0,0,0,0,0,0,0,0,0,0,66,0,0,0,0,0,1,1,2,0,0,0,0,0,0,0,0,25,12,10,0,3,0,0,0,0,0,0,0,0,0,0,0,0,0,0,0,0,0,0,0,1,0,0,0,0,0,9,19,9,3,0,1,6,0,0,1,1,0,1,0,4,0,4,0,0,1,2,0,0,5,0,0,0,0,0,0,2,0,0,0,0,0,0,1,0,0,0,0,0,0,0,0,0,0,56,0,0,0,0,0,0,0,0,0,0,0,0,0,0,0,0,5,2,3,0,0,0,0,0,0,0,0,0,0,0,0,0,0,0,0,0,0,0,0,0,0,0,0,0,0,0,1,11,4,1,0,1,2,0,0,1,0,0,2,0,2,0,2,0,0,1,0,0,0,4,0,0,0,0,0,0,2,0,0,0,0,0,0,0,0,0,0,0,0,0,0,0,0,0,14,0,0,0,0,0,0,0,0,0,0,0,0,0,0,0,0,0,0,0,0,0,0,0,0,0,0,0,0,0,0,0,0,0,0,0,0,0,0,0,0,0,0,0,0,0,0,0,0,0,0,0,0,0,0,0,0,0,0,0,0,0,0,0,0,0,0,0,0,0,0,0,0,0,0,0,0,0,0,0,0,0,0,0,0,0,0,0,0,0,0,0,0,0,0,0,0,0,0,0,0,0,0,0,0,0,0,0,0,0,0,0,0,0,0,0,0,0,0,0,0,20,0,20,6,0,0,0,0,0,0,0,0,0,0,0,0,0,0,0,0,0],"tel_aid":[0,0,0,0,0,0,0,0,0,0,0,0,0,0,0,0,0],"tel_pid":[0,1,1,2,3,4,4,4,4,4,4,4,4,4,4,4,5],"tel_purp":[0,0,0,0,0,0,0,0,0,0,0,0,0,0,0,0,0],"tel_lt":[2,2,2,1,2,2,2,2,2,2,2,2,2,2,2,2,1],"tel_pop":[0,0,0,0,1,0,3,3,2,0,3,2,0,1,1,1,0],"tel_cfr":[0,57,0,0,0,0,143,208,0,0,111,200,0,45,127,48,0],"ai_threats":[0,0,0,0,0,0,0,0,0,0,0,0,0,0,0,0,0],"satellite_data_flat":["sanitization",6,1,562,1,10,500,31,1,6,"request",11,0,900,2,6,0,23,15,25,"convertArrayBufferToString",6,0,900,2,10,0,20,4,9,"convertXMLStringToJson",3,0,900,1,10,0,16,11,13,"formatDateTime",15,0,900,1,0,0,22,14,28,"formatStatus",12,0,900,1,0,0,20,1,12,"formatLocal",12,0,900,1,0,0,20,30,41,"formatOrigin",12,0,900,1,0,0,20,43,54,"formatDestiny",12,0,900,1,0,0,20,56,67,"gerarTokenApp",52,3,697,0,0,300,66,39,90,"fetchTrackingService",28,0,900,1,6,0,28,92,119,"rastrearEncomendas",11,0,900,1,0,0,20,27,37,"fetchPrecoPrazo",44,7,562,2,6,500,161,30,73,"convertJsonToPrazoPrecoResponse",7,1,731,1,10,250,32,75,81,"calcularPrecoPrazo",16,0,900,1,11,0,22,13,28,"consultarCep",22,0,900,1,10,0,25,9,30],"satellite_offsets":[0,0,0,0,0,0,0,1,2,4,9,9,9,9,12,15,16,16],"imports":[[],[0,1,2,3,4,5],[],[],[],[6,7,8,9,10,11],[],[12,13,14],[15,16],[],[],[],[17,18,19],[20,21,22],[23,20,24,21,25],[23,20,21,25],[]],"c_ids":[0,0,0,1,0,2,3,3,3,3,3,4,4,5,5,5,0],"a_ids":[[0],[0],[0],[1],[1],[0],[0],[0],[0],[0],[0],[0],[0],[0],[0],[0],[1]],"a_dists":[[0],[0],[0],[0],[0],[0],[0],[0],[0],[0],[0],[0],[0],[0],[0],[0],[0]],"edges":[[],[],[],[],[],[],[],[],[],[],[],[],[],[],[],[],[]],"outbound_edges":[[],[],[],[],[],[],[],[],[],[],[],[],[],[],[],[],[]]},"singularity":{"paths":["yarn.lock","tests/static/stringpreco.xml","LICENSE",".gitignore",".gitattributes",".eslintrc.js",".eslintignore",".editorconfig"],"exts":[0,1,2,2,2,3,2,2],"reasons":[0,1,2,2,2,2,2,2],"sizes":[113398,0,11357,1642,66,690,33,131],"confidences":[0,0,0,0,0,0,0,0]},"story":{"status":"","why":"","who":"","significance":"","link":"","artifacts":[{"title":"","url":"","description":""}]}}

v2.7.0/Python/Python_galaxy_llm.md

## 4.5 REPOSITORY ECOSYSTEM BASELINE (GLOBAL ARCHITECTURE)

> **Assigned Ecosystem Baseline:** `Cluster 3`
> **Architectural Drift Z-Score:** `2.272`
> **⚠️ UNIQUE INTERPRETATION:** This repository has a high Z-Score. While it maps closest to this archetype, its internal structure is a highly unique or hybrid interpretation of the pattern.

### 7. `matrix/matrix_class.py` (PYTHON) -> Cumulative Risk: **594.58**

- **Archetype:** `Unclassified` (Distance: N/A IQR)
- **Magnitude:** 288.54 | **LOC:** 367 | **CtrlFlow:** 36.1% | **Authorship Centralization:** 0.0%
- **Primary Risk Drivers:** Spec Match (100.0%), Documentation (100.0%), State Flux (99.9834%), Verification (80.0%)
- **Heaviest Functions:** `add_column` (Impact: 23.0), `__init__` (Impact: 20.0), `add_row` (Impact: 18.8)

### `graphs/directed_and_undirected_weighted_graph.py` (PYTHON | Tier 1.5 | AI Safe: 0.0%)

- **Global Archetype:** `Unclassified` (Drift: 0.0 IQR)
- **Local Micro-Species:** `Unclassified` (Drift: 0.0 IQR)
- **Magnitude:** 781.88 | **LOC:** 490 | **CtrlFlow:** 33.8% | **Authorship Centralization:** 0.0%
- **Risk Profile:** Cognitive Load (79.4171%), Tech Debt (99.9882%)
**Top Internal Functions/Classes:**
  * `dfs` (Impact: 27.9)
    * *Intent:* # if no destination is meant the default value is -1
  * `dfs` (Impact: 27.9)
    * *Intent:* # if no destination is meant the default value is -1
  * `cycle_nodes` (Impact: 25.2)
  * `has_cycle` (Impact: 25.2)
  * `cycle_nodes` (Impact: 25.2)
**Contextual Mitigations & Amplifications:**
* *Amplified Cascading Flux:* 142 instances
* *State Mutation (weighted view):* 456
**Structural Signatures (Net Mitigated Signals):**
* *Structure:* `branch: 133`, `structural_boundaries: 71`, `args: 26`, `func_start: 26`, `class_start: 2`
* *Risk/State:* `safety_bypasses: 24`, `state_mutation: 172`, `dead_code: 6`, `duplicate_logic: 18`
* *Architecture:* `api: 26`, `import: 4`
* *Defense:* None
* *Network Topology:*
  * `Ecosystem Role:` Pure Producer (Foundation) | `Dependency Blast Radius (PageRank):` 0.675
  * `Choke Point (Betweenness):` 0.0 | `Ripple Effect (Closeness):` 0.000931
  * `Imports (Out-Degree: 0):` collections, math, random, time
  * `Imported By (In-Degree: 1):` (Excluded from Brief to save tokens)

### `computer_vision/mosaic_augmentation.py` (PYTHON | Tier 2 | AI Safe: 0.0%)

- **Global Archetype:** `Unclassified` (Drift: 0.0 IQR)
- **Local Micro-Species:** `Unclassified` (Drift: 0.0 IQR)
- **Magnitude:** 251.2 | **LOC:** 187 | **CtrlFlow:** 15.6% | **Authorship Centralization:** 0.0%
- **Risk Profile:** Cognitive Load (40.9715%), Tech Debt (0.0%)
**Top Internal Functions/Classes:**
  * `update_image_and_anno` (Impact: 41.2)
  * `get_dataset` (Impact: 8.3)
    * *Intent:* """ - label_dir <type: str>: Path to label include annotation of images - img_dir <type: str>: Path ...
  * `main` (Impact: 5.7)
    * *Intent:* """ Get images list and annotations list from input dir. Update new images and annotations. Save ima...
  * `random_chars` (Impact: 3.3)
    * *Intent:* """ Automatic generate random 32 characters. Get random string code: '7b7ad245cdff75241935e4dd860f3b...
**Contextual Mitigations & Amplifications:**
* *Amplified Cascading Flux:* 58 instances
* *State Mutation (weighted view):* 186
**Structural Signatures (Net Mitigated Signals):**
* *Structure:* `branch: 21`, `structural_boundaries: 22`, `args: 4`, `func_start: 4`
* *Risk/State:* `safety_bypasses: 6`, `state_mutation: 70`, `dead_code: 1`
* *Architecture:* `io: 6`, `api: 4`, `import: 6`
* *Defense:* `safety: 1`, `doc: 5`
* *Network Topology:*
  * `Ecosystem Role:` Pure Producer (Foundation) | `Dependency Blast Radius (PageRank):` 0.675
  * `Choke Point (Betweenness):` 0.0 | `Ripple Effect (Closeness):` 0.000931
  * `Imports (Out-Degree: 0):` cv2, glob, numpy, os, random, string
  * `Imported By (In-Degree: 1):` (Excluded from Brief to save tokens)