v2.7.0/pillman/pillman_galaxy_gpu.json

{"meta":{"zero_dependency_mode":false,"missing_dependencies":{"networkx":false,"tiktoken":false,"xgboost":false,"pyyaml":false},"schemas":{"galaxy_columns":["names","paths","lang_ids","locs","m_locs","d_locs","mass","author_distribution","ownership_entropy","raw_churn_freq","cog_raw","pos_x","pos_y","pos_z","risks_flat","hits_flat","tel_aid","tel_pid","tel_purp","tel_lt","tel_pop","tel_cfr","ai_threats","satellite_data_flat","satellite_offsets","imports","c_ids","a_ids","a_dists","edges","outbound_edges"],"singularity_columns":["paths","exts","reasons","sizes","confidences"],"risk_vector_x1000":["cognitive_load","safety_score","tech_debt","verification","api_exposure","concurrency","state_flux","dead_code","spec_match","stability","churn","documentation","secrets_risk"],"hit_vector":["branch","structural_boundaries","args","func_start","class_start","safety","safety_bypasses","high_risk_execution","io","api","state_mutation","dead_code","doc","test","concurrency","ui_framework","closures","globals","decorators","generics","comprehensions","scientific","reflection_metaprogramming","import","ownership","planned_debt","fragile_debt","spec_exposure","ssr_boundaries","events","dependency_injection","macros","pointers","memory_alloc","inline_asm","telemetry","debug_prints","explicit_casts","panics_and_aborts","thread_sleeps","bitwise_ops","sync_locks","immutability_locks","cleanup","encapsulation","listeners","test_skip","indent_tabs","indent_spaces","hardware_bridge","cryptography","auth_middleware","ipc_rpc_bridges","feature_flags","serialization_parsing","regex_execution","time_date_logic","llm_api","llm_orchestrator","llm_vector_store","llm_local_compute","ml_traditional","dl_frameworks","lazy_evaluation","vectorized_math","core_var_decl","design_camel_case","design_snake_case","design_pascal_case","design_upper_case","design_short_vars","design_long_vars","duplicate_logic","unreferenced_by_name","lit_code_blocks","lit_diagrams","lit_headers","lit_links","sec_reflection_metaprogramming","sec_safety_bypasses","sec_io","sec_high_risk_execution","sec_state_mutation","sec_dead_code","sec_bitwise_ops","sec_shadow_imports","sec_homoglyphs","sec_hardcoded_secrets","sec_extension_mismatch","sec_entropy","sec_tainted_injection","prompt_injection","agentic_rce","sec_unicode_steganography","sec_self_propagation"],"satellites":["name","loc","branch","angle_x10","args","type_id","control_flow_x1000","mag_x10","start_line","end_line","docstring"],"scalars":{"exposure":1000,"physics":10},"lookups":{"languages":["assembly","batch","markdown","makefile"],"textures":["standard","crystalline","plates","digital","metallic","necrosis","io","check","verification","mutation","event","logic","high_risk_execution"],"authors":["Unknown Architect"],"proofs":["Single Indicator (Ext: .asm)","Single Indicator (Ext: .bat)","Metadata Anchor (README)","Single Indicator (Exact Match)"],"purposes":["Standard Logic Matrix"],"reasons":["Blocked (Explicitly Denied Extension: '.png')","Blocked (Unsupported Extension: '.img')","Blocked (Unsupported Extension: '.com')","Blocked (System Exclusion, Hidden Directory, or Dynamic Ignored Dir)"],"exts":[".png",".img",".com","none"],"imports":[],"constellations":["__monolith__","old"],"archetypes":["Unclassified","Static: Literature & Documentation"]}},"session":{"engine":"GitGalaxy Scope vlatest (Delta Mode)","target":"pillman","timestamp":"2026-09-13T18:09:20.096644+00:00","duration_seconds":0.1,"target_directory":"/srv/storage_16tb/projects/gitgalaxy/data/corpus_assembly/pillman","git_audit":{"branch":"master","commit_hash":"d3945524359134f7db890affe64742515b1d25bd","remote_url":"https://github.com/nanochess/pillman.git","latest_commit_date":"2022-01-18T10:40:58-06:00"},"missing_dependencies":{"networkx":false,"tiktoken":false,"xgboost":false,"pyyaml":false},"zero_dependency_mode":false}},"global_summary":{"summary":{"total_files":13,"verified_files":9,"total_loc":1639,"dominant_language":"assembly","volatility_index":0.0,"Percent_Visible":69.2},"repo_macro_species":{"name":"Cluster 3","id":3,"z_score":2.272,"raw_drift":0.414},"unparsable_files":{"ambig_file_count":4,"size_limit":0,"binary":0,"unparsable":0,"os_permissions":0,"composition_by_extension_and_reason":{"no_extension":{"Blocked (System Exclusion, Hidden Directory, or Dynamic Ignored Dir)":1},".com":{"Blocked (Unsupported Extension: '.com')":1},".img":{"Blocked (Unsupported Extension: '.img')":1},".png":{"Blocked (Explicitly Denied Extension: '.png')":1}},"breakdown":{"binary":0,"unparsable":0,"no_extension":0,"size_limit":0,"os_permissions":0,"Format [unknown]":{"count":1,"details":{"Blocked (System Exclusion, Hidden Directory, or Dynamic Ignored Dir)":1}},"Format [.com]":{"count":1,"details":{"Blocked (Unsupported Extension: '.com')":1}},"Format [.img]":{"count":1,"details":{"Blocked (Unsupported Extension: '.img')":1}},"Format [.png]":{"count":1,"details":{"Blocked (Explicitly Denied Extension: '.png')":1}}}},"health":{"avg_cognitive_load":6.662,"avg_safety_score":41.161,"avg_tech_debt":13.658,"avg_documentation":77.778},"composition":{"makefile":{"files":1,"loc":16,"impact":13.22},"markdown":{"files":1,"loc":0,"impact":1.48},"batch":{"files":1,"loc":2,"impact":11.04},"assembly":{"files":6,"loc":1621,"impact":716.72}},"ecosystem_fingerprint":{"ml_clusters":{"Unclassified":{"count":8,"pct":88.9}},"static_mass":{"Static: Literature & Documentation":{"count":1,"pct":11.1}}},"ai_topology":{"classification":"Non-AI / Traditional","insights":[]},"directory_groups":{"__monolith__":{"file_count":4,"total_mass":143.06,"avg_exposures":{"cognitive_load":2.27,"safety_score":15.0,"tech_debt":8.36,"verification":21.17,"api_exposure":2.47,"concurrency":0.0,"state_flux":3.27,"dead_code":2.27,"spec_match":50.0,"stability":0.0,"churn":0.0,"documentation":50.0,"secrets_risk":0.0}},"old":{"file_count":5,"total_mass":599.4,"avg_exposures":{"cognitive_load":10.18,"safety_score":62.09,"tech_debt":17.9,"verification":80.0,"api_exposure":0.0,"concurrency":0.0,"state_flux":23.18,"dead_code":7.57,"spec_match":100.0,"stability":0.0,"churn":0.0,"documentation":100.0,"secrets_risk":0.0}}},"network_macro":{"modularity":null,"assortativity":0.0,"cyclic_density":0.0,"avg_path_length":0,"articulation_points":0},"ecosystem_audits":{"api_mapper":{"status":"no_swagger","shadow_count":0,"ghost_count":0},"xray":{"anomalies_found":0},"firewall":{"imports_whitelisted":0,"imports_unknown":0,"imports_blacklisted":0,"threats_found":0,"threats_allowed":0}},"typosquat_hits":0,"Global Architectural Fingerprint":{"Active Execution Logic (ML Clusters)":{"Unclassified":"88.9% (8 files)"},"Static Assets (Static Categories)":{"Static: Literature & Documentation":"11.1% (1 files)"}},"Repository Ecosystem Baseline (Architecture)":{"Classification":"Cluster 3","Architectural Drift (Z-Score)":2.272}},"galaxy":{"names":["pillman.asm","pillman4.asm","pillman3.asm","pillman2.asm","pillman1.asm","pillman0.asm","e.bat","README","Makefile"],"paths":["pillman.asm","old/pillman4.asm","old/pillman3.asm","old/pillman2.asm","old/pillman1.asm","old/pillman0.asm","e.bat","README","Makefile"],"lang_ids":[0,0,0,0,0,0,1,2,3],"locs":[388,336,332,346,337,339,5,74,25],"m_locs":[276,263,265,276,274,267,2,0,16],"d_locs":[83,45,39,41,35,50,1,49,1],"mass":[1173,1136,1171,1265,1145,1277,110,15,132],"author_distribution":[0,0,0,0,0,0,0,0,0],"ownership_entropy":[0,0,0,0,0,0,0,0,0],"raw_churn_freq":[0,0,0,0,0,0,0,0,0],"cog_raw":[174,179,204,207,182,251,0,0,0],"pos_x":[-12,5294,10725,7925,12855,10382,-156,2362,-2930],"pos_y":[-1311,-1337,-1803,-1564,-2293,-2277,-493,-418,-1700],"pos_z":[10530,-193,-2269,1444,4117,-1630,8655,13904,12621],"risks_flat":[90,599,334,800,0,0,130,90,1000,0,0,1000,0,92,604,136,800,0,0,133,100,1000,0,0,1000,0,101,618,135,800,0,0,206,78,1000,0,0,1000,0,102,614,121,800,0,0,188,77,1000,0,0,1000,0,93,605,121,800,0,0,148,61,1000,0,0,1000,0,119,661,379,800,0,0,480,60,1000,0,0,1000,0,0,0,0,22,0,0,0,0,0,0,0,0,0,-10,-10,-10,-10,-10,-10,-10,-10,-10,-10,-10,-10,-10,0,0,0,24,98,0,0,0,1000,0,0,1000,0],"hits_flat":[19,108,151,48,0,0,0,0,0,0,8,3,0,0,0,0,0,4,0,0,0,0,1,0,0,0,0,0,0,5,0,0,18,0,0,0,0,0,0,0,12,6,17,0,0,0,0,0,224,0,0,0,0,0,0,0,0,0,0,0,0,0,0,0,0,0,0,0,0,0,0,0,0,4,0,0,0,0,0,0,0,0,0,0,0,0,0,0,0,0,0,0,0,0,0,18,108,150,47,0,0,0,0,0,0,8,3,0,0,0,0,0,4,0,0,0,0,1,0,0,0,0,0,0,4,0,0,19,0,0,0,0,0,0,0,12,6,17,0,0,0,0,0,212,0,0,0,0,0,0,0,0,0,0,0,0,0,0,0,0,0,0,0,0,0,0,0,0,3,0,0,0,0,0,0,0,0,0,0,0,0,0,0,0,0,0,0,0,0,0,19,109,151,45,0,0,0,0,0,0,9,2,0,0,0,0,0,4,0,0,0,0,1,0,0,0,0,0,0,4,0,0,19,0,0,0,0,0,0,0,14,6,16,0,0,0,0,0,216,0,0,0,0,0,0,0,0,0,0,0,0,0,0,0,0,0,0,0,0,0,0,0,0,3,0,0,0,0,0,0,0,0,0,0,0,0,0,0,0,0,0,0,0,0,0,22,112,148,49,0,0,0,0,0,0,9,2,0,0,0,0,0,3,0,0,1,0,1,0,0,1,0,0,0,4,0,0,20,0,0,0,0,0,0,0,14,6,17,0,0,0,0,0,224,0,0,0,0,0,0,0,0,0,0,0,0,0,0,0,0,0,0,0,0,0,0,0,0,1,0,0,0,0,0,0,0,0,0,0,0,0,0,0,0,0,0,0,0,0,0,19,121,153,45,0,0,0,0,0,0,7,1,0,0,0,0,0,3,0,0,1,0,1,0,0,1,0,0,0,4,0,0,19,0,0,0,0,0,0,0,15,6,17,0,0,0,0,0,226,0,0,0,0,0,0,0,0,0,0,0,0,0,0,0,0,0,0,0,0,0,0,0,0,1,0,0,0,0,0,0,0,0,0,0,0,0,0,0,0,0,0,0,0,0,0,19,126,148,45,0,0,0,0,0,0,10,1,0,0,0,0,0,2,0,0,1,0,0,0,0,1,0,0,0,4,0,0,17,0,0,0,0,0,0,0,17,7,17,0,0,0,0,0,220,0,0,0,0,0,0,0,0,0,0,0,0,0,0,0,0,0,0,0,0,0,0,0,0,5,0,0,0,0,0,0,0,0,0,0,0,0,0,0,0,0,0,0,0,0,0,0,0,0,0,0,0,0,0,0,0,0,0,0,0,0,0,0,0,0,0,0,0,0,0,0,0,0,0,0,0,0,0,0,0,0,0,0,0,0,0,0,0,0,0,0,0,0,0,0,0,0,0,0,0,0,0,0,0,0,0,0,0,0,0,0,0,0,0,0,0,0,0,0,0,0,0,0,0,0,0,0,0,0,0,0,0,0,0,0,0,0,0,0,0,0,0,0,0,0,0,0,0,0,0,0,0,0,0,0,0,0,0,0,0,0,0,0,0,0,0,0,0,0,0,0,0,0,0,0,0,0,0,0,0,0,0,0,0,0,0,0,0,0,0,0,0,0,0,0,0,0,0,0,0,0,0,0,0,0,0,0,0,0,0,0,0,0,0,0,0,0,0,0,0,0,0,0,0,0,0,0,0,0,0,0,0,0,0,0,0,0,1,0,6,0,0,0,0,0,6,0,0,0,0,0,0,0,0,0,0,0,0,0,0,0,0,0,0,0,0,0,0,0,0,0,0,0,0,0,0,0,0,0,0,0,0,0,5,0,0,0,0,0,0,0,0,0,0,0,0,0,0,0,0,0,1,0,1,0,0,0,0,0,0,0,0,0,0,0,0,0,0,0,0,0,0,0,0,0,0,0,0,0,0,0],"tel_aid":[0,0,0,0,0,0,0,0,0],"tel_pid":[0,0,0,0,0,0,1,2,3],"tel_purp":[0,0,0,0,0,0,0,0,0],"tel_lt":[2,2,2,2,2,2,2,1,2],"tel_pop":[0,0,0,0,0,0,0,0,0],"tel_cfr":[69,68,72,80,69,71,0,0,0],"ai_threats":[0,0,0,0,0,0,0,0,0],"satellite_data_flat":["move_sprite",39,3,731,5,0,250,117,232,270,"ds4",13,2,777,4,0,182,74,134,146,"game_loop",12,2,675,2,0,333,58,169,180,"dm2",13,1,731,4,0,250,51,148,160,"ms9",6,2,562,1,0,500,45,282,287,"ms1",5,1,787,3,0,167,42,305,309,"ms4",7,1,731,2,0,250,38,292,298,"ds2",5,1,225,2,0,1000,37,127,131,"ms8",5,1,675,2,0,333,37,277,281,"ms3",4,1,562,2,0,500,37,310,313,"ms5",2,1,562,2,0,500,36,300,301,"no_key",5,1,562,1,0,500,31,181,185,"no_key2",14,0,900,5,0,0,31,194,207,"move_ghost",11,0,900,4,0,0,28,96,106,"restart",12,0,900,3,0,0,26,62,73,"draw_sprite",5,0,900,4,0,0,25,113,117,"draw_maze_row",4,0,900,3,0,0,22,74,77,"ds0",5,0,900,3,0,0,22,118,122,"dm3",4,1,225,0,0,1000,22,161,164,"close_mouth",15,0,900,1,0,0,22,208,222,"dm1",8,0,900,2,0,0,21,83,90,"no_esc",8,0,900,2,0,0,21,186,193,"move_sprite3",2,1,225,0,0,1000,21,228,229,"ms7",3,0,900,3,0,0,21,314,316,"draw_maze_col",5,0,900,2,0,0,20,78,82,"ds1",4,0,900,2,0,0,19,123,126,"ds3",2,0,900,2,0,0,18,132,133,"ms0",1,0,900,2,0,0,18,303,303,"ms6",4,0,900,1,0,0,16,273,276,"move_sprite2",2,0,900,0,0,0,11,230,231,"ms2",2,0,900,0,0,0,11,317,318,"move_sprite",35,3,731,5,0,250,115,150,184,"ds4",13,2,777,4,0,182,74,317,329,"game_loop",12,2,675,2,0,333,58,95,106,"dm2",10,1,731,4,0,250,50,80,89,"ms9",6,2,562,1,0,500,45,196,201,"ms1",5,1,787,3,0,167,42,219,223,"ms4",7,1,731,2,0,250,38,206,212,"ds2",6,1,562,2,0,500,38,309,314,"ms8",5,1,675,2,0,333,37,191,195,"ms3",4,1,562,2,0,500,37,224,227,"ms5",2,1,562,2,0,500,36,214,215,"no_key2",14,0,900,5,0,0,31,116,129,"move_ghost",11,0,900,4,0,0,28,281,291,"restart",9,0,900,3,0,0,25,53,61,"draw_sprite",5,0,900,4,0,0,25,295,299,"draw_maze_row",4,0,900,3,0,0,22,62,65,"dm3",4,1,225,0,0,1000,22,90,93,"no_key",9,0,900,2,0,0,22,107,115,"ds0",5,0,900,3,0,0,22,300,304,"dm1",8,0,900,2,0,0,21,71,78,"move_sprite3",2,1,225,0,0,1000,21,146,147,"ms7",3,0,900,3,0,0,21,228,230,"draw_maze_col",5,0,900,2,0,0,20,66,70,"close_mouth",11,0,900,1,0,0,20,130,140,"ds1",4,0,900,2,0,0,19,305,308,"ms0",1,0,900,2,0,0,18,217,217,"ds3",2,0,900,2,0,0,18,315,316,"ms6",4,0,900,1,0,0,16,187,190,"move_sprite2",2,0,900,0,0,0,11,148,149,"ms2",2,0,900,0,0,0,11,231,232,"move_sprite",35,3,731,5,0,250,115,146,180,"ds4",13,2,777,4,0,182,74,313,325,"game_loop",20,2,777,3,0,182,70,89,108,"dm2",10,1,765,4,0,200,50,74,83,"ms9",6,2,562,1,0,500,45,192,197,"ms1",5,1,787,3,0,167,42,215,219,"ms4",7,1,731,2,0,250,38,202,208,"ds2",6,1,562,2,0,500,38,305,310,"ms8",5,1,675,2,0,333,37,187,191,"ms3",4,1,562,2,0,500,37,220,223,"ms5",2,1,562,2,0,500,36,210,211,"close_mouth",14,1,838,1,0,91,35,123,136,"no_key",14,0,900,5,0,0,31,109,122,"move_ghost",11,0,900,4,0,0,28,277,287,"restart",9,0,900,3,0,0,25,47,55,"draw_sprite",5,0,900,4,0,0,25,291,295,"draw_maze_row",4,0,900,3,0,0,22,56,59,"dm3",4,1,225,0,0,1000,22,84,87,"ds0",5,0,900,3,0,0,22,296,300,"dm1",8,0,900,2,0,0,21,65,72,"move_sprite3",2,1,225,0,0,1000,21,142,143,"ms7",3,0,900,3,0,0,21,224,226,"draw_maze_col",5,0,900,2,0,0,20,60,64,"ds1",4,0,900,2,0,0,19,301,304,"ms0",1,0,900,2,0,0,18,213,213,"ds3",2,0,900,2,0,0,18,311,312,"ms6",4,0,900,1,0,0,16,183,186,"move_sprite2",2,0,900,0,0,0,11,144,145,"ms2",2,0,900,0,0,0,11,227,228,"move_sprite",34,3,715,5,0,273,115,159,192,"ds4",13,2,777,4,0,182,74,327,339,"clock_wait",12,2,675,2,0,333,58,91,102,"ms9",6,2,707,2,0,286,55,205,210,"dm2",9,1,731,3,0,250,45,79,87,"ms4",8,1,803,3,0,143,44,215,222,"ms1",5,1,787,3,0,167,42,228,232,"ds2",6,1,562,2,0,500,38,319,324,"ms8",5,1,731,2,0,250,37,199,203,"ms3",4,1,562,2,0,500,37,233,236,"ms5",3,1,562,2,0,500,36,224,226,"g1",14,1,838,1,0,91,35,136,149,"g9",16,0,900,5,0,0,32,120,135,"g5",4,1,675,1,0,333,30,104,107,"g6",4,1,562,1,0,500,30,108,111,"g7",4,1,562,1,0,500,30,112,115,"g8",4,1,562,1,0,500,30,116,119,"move_ghost",11,0,900,4,0,0,28,291,301,"restart",9,0,900,3,0,0,25,54,62,"draw_sprite",5,0,900,4,0,0,25,305,309,"ds0",5,0,900,3,0,0,22,310,314,"g2",3,0,900,3,0,0,21,63,65,"dm1",8,0,900,2,0,0,21,70,77,"move_sprite3",2,1,225,0,0,1000,21,155,156,"ms7",3,0,900,3,0,0,21,237,239,"g3",4,0,900,2,0,0,19,66,69,"ms6",4,0,900,2,0,0,19,195,198,"ds1",4,0,900,2,0,0,19,315,318,"ds3",2,0,900,2,0,0,18,325,326,"game_loop",1,0,900,0,0,0,11,89,89,"move_sprite2",2,0,900,0,0,0,11,157,158,"ms2",2,0,900,0,0,0,11,240,241,"move_sprite",32,3,755,5,0,214,114,148,179,"in2",13,2,777,4,0,182,74,318,330,"clock_wait",12,2,675,2,0,333,58,85,96,"g9",18,1,832,5,0,100,58,114,131,"ms9",7,2,731,2,0,250,55,209,215,"move_ghost",13,1,815,4,0,125,51,281,293,"dm2",9,1,731,3,0,250,45,73,81,"ms4",8,1,765,2,0,200,39,189,196,"ms5",4,1,675,2,0,333,37,181,184,"ms8",5,1,731,2,0,250,37,203,207,"g5",4,1,675,1,0,333,30,98,101,"g6",4,1,562,1,0,500,30,102,105,"g7",4,1,562,1,0,500,30,106,109,"g8",4,1,562,1,0,500,30,110,113,"ms1",11,0,900,3,0,0,25,217,227,"draw_sprite",5,0,900,4,0,0,25,300,304,"in3",5,0,900,3,0,0,22,305,309,"in1",4,0,900,3,0,0,22,314,317,"g2",3,0,900,3,0,0,21,57,59,"dm1",8,0,900,2,0,0,21,64,71,"ms3",2,0,900,3,0,0,21,228,229,"g1",11,0,900,1,0,0,20,132,142,"g3",4,0,900,2,0,0,19,60,63,"ms6",4,0,900,2,0,0,19,199,202,"in0",4,0,900,2,0,0,19,310,313,"mg1",3,0,900,1,0,0,16,294,296,"game_loop",1,0,900,0,0,0,11,83,83,"ms2",2,0,900,0,0,0,11,230,231,"move_ghost",22,3,731,5,0,250,109,170,191,"g9",22,2,815,5,0,125,84,128,149,"g4",29,2,815,3,0,125,75,68,96,"in0",13,2,787,4,0,167,74,320,332,"clock_wait",12,2,675,2,0,333,58,99,110,"mg3",8,1,787,4,0,167,49,198,205,"ms3",5,1,731,4,0,250,47,231,235,"g3",6,1,731,2,0,250,38,62,67,"g5",4,1,765,2,0,200,37,112,115,"g6",4,1,675,2,0,333,37,116,119,"g7",4,1,675,2,0,333,37,120,123,"g8",4,1,675,2,0,333,37,124,127,"g10",5,1,675,1,0,333,31,150,154,"move_sprite",8,0,900,4,0,0,26,217,224,"ms2",6,0,900,4,0,0,25,236,241,"in3",5,0,900,3,0,0,22,315,319,"ms1",2,0,900,3,0,0,21,229,230,"g1",11,0,900,1,0,0,20,155,165,"g2",3,0,900,2,0,0,19,59,61,"mg2",4,0,900,2,0,0,19,194,197,"dm1",4,0,900,2,0,0,19,262,265,"draw_sprite",3,0,900,2,0,0,19,312,314,"draw_maze",5,0,900,1,0,0,17,257,261,"mg1",3,0,900,1,0,0,16,206,208,"zero",1,0,900,1,0,0,15,304,304,"game_loop",1,0,900,0,0,0,11,97,97,"bit",1,0,900,0,0,0,11,303,303,"big_pixel",3,0,900,0,0,0,11,305,307,"pillman.com",4,0,900,0,0,0,12,11,14,"clean",4,0,900,0,0,0,12,15,18,"rundosbox",4,0,900,0,0,0,12,19,22,"all",1,0,900,0,0,0,11,6,6,"pillman.img",2,0,900,0,0,0,11,8,9,"runqemu",2,0,900,0,0,0,11,23,24],"satellite_offsets":[0,31,61,90,122,150,178,178,178,184],"imports":[[],[],[],[],[],[],[],[],[]],"c_ids":[0,1,1,1,1,1,0,0,0],"a_ids":[[0],[0],[0],[0],[0],[0],[0],[1],[0]],"a_dists":[[0],[0],[0],[0],[0],[0],[0],[0],[0]],"edges":[[],[],[],[],[],[],[],[],[]],"outbound_edges":[[],[],[],[],[],[],[],[],[]]},"singularity":{"paths":["pillman.png","pillman.img","pillman.com",".gitignore"],"exts":[0,1,2,3],"reasons":[0,1,2,3],"sizes":[309046,512,510,19],"confidences":[0,0,0,0]},"story":{"status":"","why":"","who":"","significance":"","link":"","artifacts":[{"title":"","url":"","description":""}]}}

v2.7.0/tokio/tokio_galaxy_llm.md

## 4.5 REPOSITORY ECOSYSTEM BASELINE (GLOBAL ARCHITECTURE)

> **Assigned Ecosystem Baseline:** `Cluster 3`
> **Architectural Drift Z-Score:** `2.272`
> **⚠️ UNIQUE INTERPRETATION:** This repository has a high Z-Score. While it maps closest to this archetype, its internal structure is a highly unique or hybrid interpretation of the pattern.

### 4. `tokio/src/fs/read_uring.rs` (RUST) -> Cumulative Risk: **659.62**

- **Archetype:** `Unclassified` (Distance: N/A IQR)
- **Magnitude:** 100.76 | **LOC:** 135 | **CtrlFlow:** 21.7% | **Authorship Centralization:** 50.0%
- **Primary Risk Drivers:** Concurrency (100.0%), Spec Match (100.0%), Documentation (100.0%), State Flux (99.9436%)
- **Heaviest Functions:** `read_to_end_uring` (Impact: 21.2), `op_read` (Impact: 10.1), `small_probe_read` (Impact: 7.2)

### 10. `tokio/src/runtime/time_alt/cancellation_queue/tests.rs` (RUST) -> Cumulative Risk: **621.74**

- **Archetype:** `Unclassified` (Distance: N/A IQR)
- **Magnitude:** 46.16 | **LOC:** 98 | **CtrlFlow:** 15.4% | **Authorship Centralization:** 100.0%
- **Primary Risk Drivers:** Spec Match (100.0%), Documentation (100.0%), State Flux (98.6166%), Concurrency (95.472%)
- **Heaviest Functions:** `multi_thread` (Impact: 10.2), `single_thread` (Impact: 4.7), `drop_iter_should_not_leak_memory` (Impact: 3.8)

### `tokio/tests/rt_threaded.rs` (RUST | Tier 2 | AI Safe: 0.0%)

- **Global Archetype:** `Unclassified` (Drift: 0.0 IQR)
- **Magnitude:** 537.64 | **LOC:** 954 | **CtrlFlow:** 9.5% | **Authorship Centralization:** 50.0%
- **Risk Profile:** Cognitive Load (43.3538%), Tech Debt (0.0%)
**Top Internal Functions/Classes:**
  * `test_tuning` (Impact: 22.7)
    * *Intent:* // Testing the tuning logic is tricky as it is inherently timing based, and more // of a heuristic t...
  * `many_multishot_futures` (Impact: 13.2)
  * `drop_threadpool_drops_futures` (Impact: 8.8)
  * `blocking` (Impact: 8.3)
  * `wake_during_shutdown` (Impact: 8.1)
    * *Intent:* /// Demonstrates tokio-rs/tokio#3869
**Contextual Mitigations & Amplifications:**
* *Mitigated Danger:* 1 instances
* *Mitigated Memory Allocs:* 6 instances
* *Amplified Race Conditions:* 32 instances
* *Amplified Cascading Flux:* 20 instances
* *High Risk Execution (weighted view):* 0
* *Concurrency (weighted view):* 294
* *Memory Alloc (weighted view):* 13
* *State Mutation (weighted view):* 66
**Structural Signatures (Net Mitigated Signals):**
* *Structure:* `branch: 66`, `structural_boundaries: 249`, `args: 60`, `func_start: 41`, `class_start: 3`
* *Risk/State:* `safety_bypasses: 63`, `high_risk_execution: 1`, `state_mutation: 26`, `unreferenced_by_name: 30`
* *Architecture:* `io: 1`, `concurrency: 134`, `import: 17`
* *Defense:* `safety: 3`, `doc: 7`, `test: 46`, `sync_locks: 26`, `immutability_locks: 6`, `cleanup: 10`
* *Network Topology:*
  * `Ecosystem Role:` Isolated/Orphan | `Dependency Blast Radius (PageRank):` 1.171
  * `Choke Point (Betweenness):` 0.0 | `Ripple Effect (Closeness):` 0.0
  * `Imports (Out-Degree: 0):` Arc, AsyncWriteExt, Future, Mutex, Ordering, Poll, RecvTimeoutError, TcpStream...
  * `Imported By (In-Degree: 0):` None (Orphan / Entrypoint)

### `tokio/tests/task_local_set.rs` (RUST | Tier 2 | AI Safe: 0.0%)

- **Global Archetype:** `Unclassified` (Drift: 0.0 IQR)
- **Magnitude:** 495.22 | **LOC:** 809 | **CtrlFlow:** 5.0% | **Authorship Centralization:** 0.0%
- **Risk Profile:** Cognitive Load (44.4683%), Tech Debt (0.0%)
**Top Internal Functions/Classes:**
  * `local_tasks_are_polled_after_tick_inner` (Impact: 11.1)
  * `with_timeout` (Impact: 8.7)
    * *Intent:* /// Runs a test function in a separate thread, and panics if the test does not /// complete within t...
  * `complete` (Impact: 6.1)
  * `run_until_does_not_get_own_budget` (Impact: 5.2)
    * *Intent:* // This test compares that, when the task driving `run_until` has already // consumed budget, the `r...
  * `drop_cancels_remote_tasks` (Impact: 4.2)
**Contextual Mitigations & Amplifications:**
* *Mitigated Memory Allocs:* 1 instances
* *Amplified Race Conditions:* 34 instances
* *Amplified Cascading Flux:* 6 instances
* *Concurrency (weighted view):* 339
* *Memory Alloc (weighted view):* 1
* *State Mutation (weighted view):* 31
**Structural Signatures (Net Mitigated Signals):**
* *Structure:* `branch: 32`, `structural_boundaries: 213`, `args: 82`, `func_start: 38`, `class_start: 2`
* *Risk/State:* `safety_bypasses: 36`, `high_risk_execution: 8`, `state_mutation: 19`, `dead_code: 1`, `fragile_debt: 1`, `unreferenced_by_name: 29`
* *Architecture:* `concurrency: 169`, `import: 24`
* *Defense:* `safety: 1`, `doc: 7`, `test: 64`, `sync_locks: 4`, `immutability_locks: 26`, `cleanup: 7`
* *Network Topology:*
  * `Ecosystem Role:` Pure Consumer (Orchestrator) | `Dependency Blast Radius (PageRank):` 1.171
  * `Choke Point (Betweenness):` 0.0 | `Ripple Effect (Closeness):` 0.0
  * `Imports (Out-Degree: 2):` FutureExt, LocalSet, Poll, futures::
    future::pending, futures::future, futures::future::join_all, futures::future::pending, oneshot...
  * `Imported By (In-Degree: 0):` None (Orphan / Entrypoint)